1;V pour Vendetta;"Londres, au 21ème siècle...
Evey Hammond ne veut rien oublier de l'homme qui lui sauva la vie et lui permit de dominer ses peurs les plus lointaines. Mais il fut un temps où elle n'aspirait qu'à l'anonymat pour échapper à une police secrète omnipotente. Comme tous ses concitoyens, trop vite soumis, elle acceptait que son pays ait perdu son âme et se soit donné en masse au tyran Sutler et à ses partisans.
Une nuit, alors que deux ""gardiens de l'ordre"" s'apprêtaient à la violer dans une rue déserte, Evey vit surgir son libérateur. Et rien ne fut plus comme avant.
Son apprentissage commença quelques semaines plus tard sous la tutelle du mystérieux ""V""..";19/04/2006;Science-Fiction, Fantastique, Thriller, Action;James Mc Teigue
2;Fight Club;Le narrateur, sans identité précise, vit seul, travaille seul, dort seul, mange seul ses plateaux-repas pour une personne comme beaucoup d'autres personnes seules qui connaissent la misère humaine, morale et sexuelle. C'est pourquoi il va devenir membre du Fight club, un lieu clandestin ou il va pouvoir retrouver sa virilité, l'échange et la communication. Ce club est dirigé par Tyler Durden, une sorte d'anarchiste entre gourou et philosophe qui prêche l'amour de son prochain.;10/11/1999;Thriller Drame;David Fincher
3;Il était une fois la révolution;Mexique, 1913. Un pilleur de diligences, Juan Miranda, et un Irlandais, ancien membre de l'IRA spécialiste en explosifs, John Mallory, font connaissance. Juan a toujours rêvé de dévaliser la banque centrale de Mesa Verde et voit en John le complice idéal pour son braquage. Il fait chanter John afin de le persuader de s'associer à l'affaire.;29/03/1972;Western, Guerre;Sergio Leone
;;Tous deux se trouvent plongés en plein coeur de la tourmente de la révolution mexicaine, et Mesa Verde se révèle plus riche en prisonniers politiques qu'en lingots d'or. Malgré eux, les deux amis deviennent les héros d'une guerre qui n'est pas la leur...;;;
